{
  "schema_version": "1.0",
  "incident_id": "inc_confirmation_demo_001",
  "correlation_id": "corr_confirmation_demo_001",
  "review_id": "review-demo-001",
  "reviewer_id": "operator-demo-001",
  "confirmation": "HUMAN_CONFIRMED",
  "confirmed_cause": "PROVIDER_DEGRADATION",
  "prior_playbook_id": "PB-ISSUER-INVESTIGATION",
  "evidence_ids": ["evd-confirmation-demo-001"],
  "provenance": "REAL_HUMAN_REVIEW",
  "occurred_at": "2026-08-30T12:00:00+00:00"
}
